{"$schema":"https://json-schema.org/draft/2020-12/schema","additionalProperties":false,"description":"Governed persisted advisory record envelope cryptographically binding preliminary advisory reviews from Gemini or Claude to the exact candidate and blind review packet bytes.","properties":{"blindPacketSha256":{"pattern":"^sha256:[a-f0-9]{64}$","type":"string"},"candidateId":{"pattern":"^(scale500|exp100)-tmdb-[0-9]+$","type":"string"},"materialityPolicySha256":{"pattern":"^sha256:[a-f0-9]{64}$","type":"string"},"rawResponseSha256":{"pattern":"^sha256:[a-f0-9]{64}$","type":"string"},"reviewPromptSha256":{"pattern":"^sha256:[a-f0-9]{64}$","type":"string"},"reviewer":{"enum":["GEMINI","CLAUDE"],"type":"string"},"reviewerModel":{"minLength":1,"type":"string"},"validatedOpinion":{"additionalProperties":false,"allOf":[{"if":{"properties":{"preliminaryDecision":{"const":"APPROVE"}},"required":["preliminaryDecision"]},"then":{"properties":{"affectedFields":{"maxItems":0},"issueSummaries":{"maxItems":0},"preliminarySeverity":{"type":"null"}}}},{"if":{"properties":{"preliminaryDecision":{"const":"REVISE"}},"required":["preliminaryDecision"]},"then":{"properties":{"affectedFields":{"minItems":1},"issueSummaries":{"minItems":1},"preliminarySeverity":{"enum":["MINOR","SEVERE"]}}}}],"properties":{"advisoryOnly":{"const":true,"type":"boolean"},"affectedFields":{"items":{"enum":["description","whyWatch","curiosityHook","vibeSummary"],"type":"string"},"type":"array"},"claimSpan":{"type":"string"},"confidence":{"enum":["LOW","MEDIUM","HIGH"],"type":"string"},"issueSummaries":{"items":{"type":"string"},"type":"array"},"preliminaryDecision":{"enum":["APPROVE","REVISE"],"type":"string"},"preliminarySeverity":{"enum":["MINOR","SEVERE",null],"type":["string","null"]},"sourceBoundaryReason":{"minLength":1,"type":"string"},"sourceEvidence":{"items":{"additionalProperties":false,"properties":{"notes":{"type":["string","null"]},"source":{"type":"string"},"supportFound":{"type":"boolean"}},"required":["source","supportFound"],"type":"object"},"type":"array"},"uncertaintyNotes":{"type":["string","null"]}},"required":["preliminaryDecision","preliminarySeverity","affectedFields","issueSummaries","claimSpan","sourceEvidence","sourceBoundaryReason","confidence","advisoryOnly"],"type":"object"}},"required":["candidateId","blindPacketSha256","reviewer","reviewerModel","reviewPromptSha256","materialityPolicySha256","rawResponseSha256","validatedOpinion"],"title":"PreliminaryAdvisoryRecordEnvelopeV1","type":"object"}
