{"blindPacketSha256":"sha256:3e86c3ed6c5f03b6ed9e42e7f76719e6a271712d459255a19d74a9efd3219ea6","candidateId":"exp100-tmdb-17918","materialityPolicySha256":"sha256:21661892df4d1b009341b6d34de3bf5ad1ae17e3447abbdace15e1c31a5b843c","rawResponseSha256":"sha256:ee0551253fb28745f57f6650b529dde6f0f594b32dd121259b7e07cbe221cac6","reviewPromptSha256":"sha256:de665f3e3157ccbbf896d6af2ae86e7c7e83fc2501e1be069ba50613d4d70628","reviewer":"CLAUDE","reviewerModel":"MANUAL_CONSUMER_UI","validatedOpinion":{"advisoryOnly":true,"affectedFields":[],"claimSpan":"","confidence":"MEDIUM","issueSummaries":[],"preliminaryDecision":"APPROVE","preliminarySeverity":null,"sourceBoundaryReason":"Every concrete claim (Dr. Alec Holland, the secret-formula mutation, Swamp Thing as a half-human, half-plant figure, government agent Alice Cable, an evil arch-nemesis, the life-costing stakes, the director, year, runtime and genres) is grounded in the authorized overview. The remaining language ('mantle', 'monstrous', 'protect', 'ruthless', 'perilous fight', 'pulp action') is figurative characterization, genre shorthand or minor terminology variation. None of it works as a meaningful new factual claim about plot mechanics, identities, relationships, motives or causality under A_PRIME_PRODUCTION_MATERIALITY_V1. The copy stays at the premise and initial conflict. The survival question presupposes no outcome, and no reversal or ending is stated, so no spoiler-boundary content appears.","sourceEvidence":[{"notes":"description: the formula mutating Dr. Alec Holland, the half-plant transformation into Swamp Thing, the rescue of government agent Alice Cable, and the confrontation with his arch-nemesis all restate the overview. 'Experimental' loosely glosses 'secret formula'. 'Ruthless' echoes 'evil'. 'Confront' softens 'defeat'. 'Takes on the mantle of Swamp Thing' is a figurative gloss on 'becomes Swamp Thing' and is discussed under uncertaintyNotes.","source":"facts.overview","supportFound":true},{"notes":"curiosityHook: 'transformed... by his own creation' restates 'mutated by his own secret formula'. 'Will Alec Holland survive the perilous fight' echoes the overview's 'even if it costs him his life'. 'Monstrous swamp creature' is a characterization the overview frames as 'superhero', and it is discussed under uncertaintyNotes. 'Protect Alice Cable' loosely paraphrases 'rescue'. The interrogative asserts no outcome.","source":"facts.overview","supportFound":true},{"notes":"vibeSummary and whyWatch: 'sci-fi horror', 'creature horror' and 'genre crossover' are consistent with genres Horror/Science Fiction. 'Comic-book heroics' is supported by the overview's 'superhero', and 'comic book' also appears in facts.keywords. 'Wes Craven', '1982' and '91 minutes' match director, year and runtimeMinutes. 'Pulp action' and 'creature-feature fun' are tonal shorthand.","source":"facts.genres","supportFound":true},{"notes":"acceptedSemanticClassification: 'Suspenseful' and 'exciting' match moods. 'Fast-moving' is slightly off pace=medium and is tonal only. 'Engaging' matches attentionDemand=engaged. 'Casual movie night with friends' matches situations=[friends, easy-watch]. Keyword-only material (body horror, swamp) is not imported.","source":"other","supportFound":true}],"uncertaintyNotes":"Three items sit near the tolerance line. 'Monstrous swamp creature' in curiosityHook frames Swamp Thing as a monster where the overview calls him a 'superhero'. 'Takes on the mantle' implies a deliberate adoption of the role where the overview says he 'becomes' Swamp Thing. 'Protect' in place of 'rescue' shifts the framing slightly, since 'rescue' implies she is already in peril or captive. I read all three as characterization and terminology variation, since none names a new event, relationship or outcome and none changes what a viewer would expect. A stricter adjudicator could ask for 'superhero', 'becomes' and 'rescue' to be restored, in which case they would be MINOR alias or terminology substitutions. 'Fast-moving' sits slightly against the accepted pace of medium and is tonal only."}}
