{"blindPacketSha256":"sha256:666c6ebc362a3be8b0ec2c0596d599a4d8627e7f8452be1da61fff61e3e0ec0d","candidateId":"scale500-tmdb-12143","materialityPolicySha256":"sha256:21661892df4d1b009341b6d34de3bf5ad1ae17e3447abbdace15e1c31a5b843c","rawResponseSha256":"sha256:af4ec37d5110dfa9edf63b277ab2150fb754f1535f71af173f752a50b9c75e42","reviewPromptSha256":"sha256:de665f3e3157ccbbf896d6af2ae86e7c7e83fc2501e1be069ba50613d4d70628","reviewer":"CLAUDE","reviewerModel":"MANUAL_CONSUMER_UI","validatedOpinion":{"advisoryOnly":true,"affectedFields":[],"claimSpan":"","confidence":"MEDIUM","issueSummaries":[],"preliminaryDecision":"APPROVE","preliminarySeverity":null,"sourceBoundaryReason":"Every concrete claim (New York City, corrupt police detective, serious drug and gambling addiction, the young nun's rape investigation, the attempt to change and find forgiveness, the director, the genres) is grounded in the packet. The remaining language ('atrocious crime', 'spiral swallows him whole', 'unexpected struggle', 'intense personal reckoning', 'spiritual weight') is figurative characterization, thematic shorthand, or metaphorical urgency. None of it functions as a meaningful new factual claim about plot mechanics, identities, relationships, motives, or causality under A_PRIME_PRODUCTION_MATERIALITY_V1. The copy stays at the premise and initial conflict, and it states no outcome for the detective's attempt at redemption and no later revelation or ending. No spoiler-boundary content appears.","sourceEvidence":[{"notes":"description: New York City, the corrupt police detective, the serious drug and gambling addiction, the investigation of a young nun's rape, and the attempt to change his ways and find forgiveness all restate the overview. 'Severe' paraphrases 'serious'. 'Takes on the investigation' paraphrases 'while investigating'. 'Sparking an unexpected struggle' links the investigation to the struggle to change and adds 'unexpected'. It is discussed under uncertaintyNotes.","source":"facts.overview","supportFound":true},{"notes":"curiosityHook: the atrocious crime, the detective's vices (drugs and gambling), and the attempt to turn his life around restate the overview. 'Atrocious' is evaluative characterization of a rape investigation. 'Genuinely turn his life around' paraphrases 'tries to change his ways'. 'Before his spiral swallows him whole' is metaphorical urgency. It implies a downfall is possible but names no event, outcome, or ending. The interrogative asserts no resolution.","source":"facts.overview","supportFound":true},{"notes":"whyWatch: 'moral drama' and 'procedural grit' are consistent with genres Crime/Drama and the police-investigation premise. 'Abel Ferrara' matches director. 'Moral crisis', 'personal reckoning' and 'spiritual weight' are thematic shorthand built on 'change his ways and find forgiveness'. 'Raw' and 'uncompromising' are tonal flourishes.","source":"facts.genres","supportFound":true},{"notes":"acceptedSemanticClassification: 'Grim' and 'emotionally heavy' match emotionalWeight=heavy and mood emotional. 'Suspenseful' matches moods. 'Full attention alone' matches attentionDemand=engaged and situations=[alone]. Keyword-only material (heroin, baseball, Catholicism, crucifixion, Christ figure, drug dealer, teenage girl) is not imported.","source":"other","supportFound":true}],"uncertaintyNotes":"The one near-threshold item is 'sparking an unexpected struggle' in description. The overview links the two only by simultaneity ('While investigating... tries to change his ways'), so 'sparking' turns that into a cause, and 'unexpected' is an unstated characterization. I read the phrase as narrative framing of the stated premise that names no event or outcome, so I kept it within tolerance. A stricter adjudicator could ask for 'sparking an unexpected struggle' to be softened toward the source's own 'while... tries to change his ways', in which case it would be a MINOR causal concretization. The curiosityHook's 'before his spiral swallows him whole' implies a downfall is possible, but it is posed as a question and names no outcome."}}
