{"blindPacketSha256":"sha256:143a3c375a9321f24b5b8700323960a8cf631d1f5813d63a06558b14cc28b04d","candidateId":"scale500-tmdb-15789","materialityPolicySha256":"sha256:21661892df4d1b009341b6d34de3bf5ad1ae17e3447abbdace15e1c31a5b843c","rawResponseSha256":"sha256:44dce24c741903ebd96502c6149138887e2f0c855ef897178f3799eaf68242f7","reviewPromptSha256":"sha256:e822b0eef3c9d0b0ece2365aa884593cd3de2eefafd50a3aa3ef2b77cf0847a5","reviewer":"GEMINI","reviewerModel":"MANUAL_CONSUMER_UI","validatedOpinion":{"advisoryOnly":true,"affectedFields":["vibeSummary"],"claimSpan":"fast-paced","confidence":"HIGH","issueSummaries":["The vibeSummary characterizes the film as 'fast-paced', which overstates the narrative tempo and conflicts with the authorized classification of pace: 'medium'."],"preliminaryDecision":"REVISE","preliminarySeverity":"MINOR","sourceBoundaryReason":"Under closed-world source authority and A_PRIME_PRODUCTION_MATERIALITY_V1, experiential descriptors in visible copy must remain accurately calibrated to the authorized acceptedSemanticClassification. Characterizing the film as 'fast-paced' in vibeSummary escalates the narrative tempo against the classified pace of 'medium', introducing an unsupported pace escalation on a decision-relevant viewer expectation axis. Because this is an isolated, easily fixable phrasing issue in an otherwise compliant record, it represents a MINOR defect requiring revision.","sourceEvidence":[{"notes":"acceptedSemanticClassification explicitly classifies pace as 'medium'. Describing the film as 'fast-paced' in vibeSummary directly escalates the narrative tempo toward 'fast', misrepresenting a primary decision-relevant experiential axis.","source":"other","supportFound":false},{"notes":"Directly supports Max desperate to impress his crush, Goofy suddenly whisking him on a cross-country road trip, disrupting his date plans, and their clashing agendas causing comedic mishaps.","source":"facts.overview","supportFound":true},{"notes":"Directly confirms Animation, Comedy, Family, and Adventure genres reflected across visible copy.","source":"facts.genres","supportFound":true}],"uncertaintyNotes":"The description, curiosityHook, and whyWatch strictly adhere to authorized baseline facts, keywords, and semantic classifications without leaking ungrounded franchise lore or third-act concert/resolution spoilers. In whyWatch, 'brisk 78-minute journey' functions as an acceptable description of a short physical runtime, but 'fast-paced' in vibeSummary directly asserts an unsupported fast pace."}}
