{"blindPacketSha256":"sha256:a3fb71601a05f1204cde09e94d47e90d3dec1b33e64f5981dff247a454841ce5","candidateId":"exp100-tmdb-10377","materialityPolicySha256":"sha256:21661892df4d1b009341b6d34de3bf5ad1ae17e3447abbdace15e1c31a5b843c","rawResponseSha256":"sha256:ccbe9cafa093a2c58f5b87560e74d856c11ec37077ce48aaa0c7881b3b49d342","reviewPromptSha256":"sha256:de665f3e3157ccbbf896d6af2ae86e7c7e83fc2501e1be069ba50613d4d70628","reviewer":"CLAUDE","reviewerModel":"MANUAL_CONSUMER_UI","validatedOpinion":{"advisoryOnly":true,"affectedFields":[],"claimSpan":"","confidence":"MEDIUM","issueSummaries":[],"preliminaryDecision":"APPROVE","preliminarySeverity":null,"sourceBoundaryReason":"All editorial claims trace back to the authorized overview or facts fields (director, genres) and the accepted semantic classification, excluding reliance on facts.keywords as instructed. Any embellishment (e.g., 'sharp girlfriend', 'sheer instinct', 'cultural friction') is low-risk figurative/atmospheric language under A_PRIME_PRODUCTION_MATERIALITY_V1 and does not alter viewer expectations about plot mechanics, identity, motives, or outcomes. No spoiler-boundary items (reversals, later revelations, endings) are disclosed; content stays within the allowed premise/initial-conflict/tone scope.","sourceEvidence":[{"notes":"The description's core claims (two college-bound friends mistakenly/wrongfully arrested for murder in rural Alabama; cousin Vincent Gambini, a newly-barred Brooklyn lawyer, arrives with his girlfriend to try his first case) map directly onto the authorized overview without invented plot mechanics.","source":"allowedSourceMaterial.overview","supportFound":true},{"notes":"curiosityHook's claim that Vincent passed the bar on his sixth try and has never tried a case before is explicitly stated in the overview ('just passed his bar exam after his sixth try' / 'to try his first case'). The phrase 'innocent kin' is a low-risk inference consistent with 'mistakenly arrested' and does not reveal any later plot outcome.","source":"allowedSourceMaterial.overview","supportFound":true},{"notes":"whyWatch correctly attributes direction to Jonathan Lynn (facts.director) and frames the film within its Comedy/Drama genres via 'comedy' and 'real courtroom stakes' language, without overstating factual specifics.","source":"facts","supportFound":true},{"notes":"vibeSummary's 'funny, medium-paced legal comedy' directly reflects the authorized moods (funny) and pace (medium) classifications.","source":"acceptedSemanticClassification","supportFound":true},{"notes":"Descriptive flourishes such as 'sharp girlfriend,' 'sheer instinct,' 'lively cultural friction,' and 'Brooklyn swagger' are stylistic/atmospheric embellishments of details already present in the overview (leather-clad girlfriend, Brooklyn mechanic-turned-lawyer, Deep South culture shock) and do not introduce new factual claims about plot, identity, or outcome.","source":"other","supportFound":true}],"uncertaintyNotes":"vibeSummary's phrase 'Southern courtroom procedure' is a mild inferential concretization from the overview's mention of a murder charge and a lawyer's first case; it is not independently confirmed by non-keyword source fields, but it is a low-materiality genre-consistent inference rather than a new factual claim."}}
