{"blindPacketSha256":"sha256:fa237fbe80c25e9e0e2b0eb025af6a84544c5573e0468d7389e23bcdfb69c80f","candidateId":"scale500-tmdb-75629","materialityPolicySha256":"sha256:21661892df4d1b009341b6d34de3bf5ad1ae17e3447abbdace15e1c31a5b843c","rawResponseSha256":"sha256:1d2b60e813bbcb5213f17ee2f2e79dc2aa17c1f427e6765ef74a87301c04ccc8","reviewPromptSha256":"sha256:de665f3e3157ccbbf896d6af2ae86e7c7e83fc2501e1be069ba50613d4d70628","reviewer":"CLAUDE","reviewerModel":"MANUAL_CONSUMER_UI","validatedOpinion":{"advisoryOnly":true,"affectedFields":[],"claimSpan":"","confidence":"HIGH","issueSummaries":[],"preliminaryDecision":"APPROVE","preliminarySeverity":null,"sourceBoundaryReason":"All four fields stay within the premise, starting situation and initial conflict in the overview, and none reveals reversals, later relationship outcomes, third-act events or the ending. The deviations are low-risk under A_PRIME_PRODUCTION_MATERIALITY_V1: 'dread', 'brisk, concentrated', 'high-stakes' and 'suspenseful escalations' are tonal and figurative language backed by the semantic classification, and 'alongside Kaworu' and 'a new battle' are minor inferences from the overview. None materially changes plot mechanics, identity, relationships, motives, causality or quantities, and no external Evangelion lore is imported.","sourceEvidence":[{"notes":"The description's core details match the overview: fourteen years after Third Impact, Shinji awakening, 'unaged' for 'hasn't aged', NERV dismantled, a ruined world, and the enigmatic Kaworu. 'Former allies have turned hostile' restates 'people who he once protected have turned against him' and the mention of fighting 'former allies'.","source":"facts.overview","supportFound":true},{"notes":"'Alongside the enigmatic Kaworu' is a light inference from 'Befriending the enigmatic Kaworu, Shinji continues the fight'. 'A new battle' loosely restates the continued fight against the angels. Neither adds a new plot mechanic, relationship outcome or identity.","source":"facts.overview","supportFound":true},{"notes":"The curiosityHook's 'friends are now foes', 'whom can you trust', and 'the next clash could end everything' are rhetorical reframings of the turned-against-him premise and the overview's 'what could inevitably be the end of the world'. The hook is interrogative and does not assert a new fact. 'Ruined future' matches 'Much of Earth is laid in ruins'.","source":"facts.overview","supportFound":true},{"notes":"whyWatch's 'pitting former comrades against each other' is supported by the overview's fighting 'against his former allies' and 'battles against the angels and each other'. 'Apocalyptic dread' and 'high-stakes' are atmospheric shorthand for the end-of-the-world framing.","source":"facts.overview","supportFound":true},{"notes":"acceptedSemanticClassification (attentionDemand immersive, emotionalWeight heavy, pace fast, moods exciting/emotional/suspenseful) supports the vibeSummary and whyWatch tone descriptors ('immersive and heavy', 'suspenseful', 'fast-moving', 'emotionally heavy'). facts.genres (Action, Animation, Drama, Science Fiction) supports 'sci-fi action', 'sci-fi drama' and 'animated warfare'.","source":"other","supportFound":true}],"uncertaintyNotes":"'Alongside the enigmatic Kaworu' could be read as slightly specifying that they fight together, when the overview only says Shinji befriends Kaworu and continues the fight. I judged it a harmless inference from the befriending and continued-fight framing. 'Suspenseful escalations' is tonal and matches the accepted moods, not a plot claim."}}
