{"blindPacketSha256":"sha256:507ad03cceb1b37a7de9c210efcba48e73ebcbb65a448f7aea9a2a719aa270cf","candidateId":"exp100-tmdb-26320","materialityPolicySha256":"sha256:21661892df4d1b009341b6d34de3bf5ad1ae17e3447abbdace15e1c31a5b843c","rawResponseSha256":"sha256:42d39ca0e68478f444dd6d89478918ca0c5e4ed745df00dacd2211b2a0a70ae1","reviewPromptSha256":"sha256:e822b0eef3c9d0b0ece2365aa884593cd3de2eefafd50a3aa3ef2b77cf0847a5","reviewer":"GEMINI","reviewerModel":"MANUAL_CONSUMER_UI","validatedOpinion":{"advisoryOnly":true,"affectedFields":[],"claimSpan":"","confidence":"HIGH","issueSummaries":[],"preliminaryDecision":"APPROVE","preliminarySeverity":null,"sourceBoundaryReason":"All visible editorial copy strictly complies with A_PRIME_PRODUCTION_MATERIALITY_V1. The synopsis and curiosity hook adhere faithfully to the authorized overview and verified keywords without importing ungrounded external festival trivia, artist cameos, or third-act narrative outcomes. Framing phrases such as 'chaotic logistics' and 'legendary counterculture milestone' represent legitimate, low-risk atmospheric inference and genre shorthand capturing the authorized scale of the event and its cultural impact, while experiential descriptors in whyWatch and vibeSummary cleanly map to verified metadata and authorized semantic classifications.","sourceEvidence":[{"notes":"Directly supports Elliot Tiber seeking much-needed business for his parents' run-down motel after a neighboring town pulled the permit for a music festival, connecting organizers to his neighbor's farm, and inadvertently catalyzing the massive Woodstock gathering of half a million people.","source":"facts.overview","supportFound":true},{"notes":"Directly confirms Comedy and Drama genres, grounding the 'blend of comedy and drama' in vibeSummary.","source":"facts.genres","supportFound":true},{"notes":"facts.director verifies Ang Lee. facts.keywords verifies 'catskills' and 'music festival'. Accepted semantic classification directly grounds pace: medium ('medium-paced'), emotionalWeight: moderate ('moderate emotional weight'), attentionDemand: engaged ('steady engagement'), and moods: [funny, emotional, thoughtful] ('warm').","source":"other","supportFound":true}],"uncertaintyNotes":null}}
