{"blindPacketSha256":"sha256:9970d91259c016e35b1551e2ba80cb606f1255120ceb51b13d1e3bb9921c264d","candidateId":"scale500-tmdb-15080","materialityPolicySha256":"sha256:21661892df4d1b009341b6d34de3bf5ad1ae17e3447abbdace15e1c31a5b843c","rawResponseSha256":"sha256:16ff4009953d11fc25442295556061a0b65ceb8a6d480c7284c876ecf22b9c73","reviewPromptSha256":"sha256:e822b0eef3c9d0b0ece2365aa884593cd3de2eefafd50a3aa3ef2b77cf0847a5","reviewer":"GEMINI","reviewerModel":"MANUAL_CONSUMER_UI","validatedOpinion":{"advisoryOnly":true,"affectedFields":[],"claimSpan":"","confidence":"HIGH","issueSummaries":[],"preliminaryDecision":"APPROVE","preliminarySeverity":null,"sourceBoundaryReason":"All visible editorial copy strictly complies with A_PRIME_PRODUCTION_MATERIALITY_V1. The narrative premise and reflective internal conflict in the description and curiosityHook faithfully adhere to the authorized overview without importing ungrounded plot specifics (such as countryside safflower farming or rural romance), external studio lore (such as Studio Ghibli), or third-act spoiler revelations. Experiential and tonal descriptors across whyWatch and vibeSummary map cleanly to verified metadata and accepted semantic classifications.","sourceEvidence":[{"notes":"Directly supports Taeko moving between past and present, confronting childhood memories and youth, and questioning whether she has remained true to the dreams of her childhood self.","source":"facts.overview","supportFound":true},{"notes":"Directly verifies the Animation and Drama genre designations utilized across visible copy.","source":"facts.genres","supportFound":true},{"notes":"facts.director verifies Isao Takahata. Accepted semantic classification directly grounds pace: slow ('slow-paced', 'patient'), moods: [thoughtful, emotional] ('thoughtful', 'gently emotional'), emotionalWeight: moderate ('delicate emotional weight'), attentionDemand: engaged ('demanding attentive'), and situations: alone ('solo viewing').","source":"other","supportFound":true}],"uncertaintyNotes":null}}
